{
  "schema_version": 2,
  "revision": 2,
  "catalog_id": "models_person_face_qcs6490_v1",
  "models": [
    {
      "model_id": "yolov8n_person",
      "model_version": "1.0",
      "target_id": "qcs6490",
      "artifact_ref": "yolov8n_person_w8a16.so",
      "artifact_sha256": "99ee47cdf02f024bafefe066234d9b7e9e04e87e38ef8f3afd0eb77495370956",
      "output_manifest_ref": "yolov8n_person_outputs_v1",
      "decoder_contract": "yolo.v8.detect",
      "preprocess_contract": "nv12_rgb_letterbox_person_v1",
      "graph_name": "yolov8n_person_w8a16",
      "preprocess": {
        "source_format": "nv12",
        "color_matrix": "bt709",
        "color_range": "limited",
        "resize": "letterbox",
        "interpolation": "bilinear",
        "placement": "centre",
        "pad_value": [
          114.0,
          114.0,
          114.0
        ],
        "channel_order": "rgb",
        "normalization": {
          "formula": "offset_scale",
          "offset": [
            0.0,
            0.0,
            0.0
          ],
          "scale": [
            0.00392156862745098,
            0.00392156862745098,
            0.00392156862745098
          ]
        },
        "coordinates": "tensor_pixels_xywh"
      },
      "input": {
        "width": 640,
        "height": 640,
        "dtype": "uint16",
        "channel_order": "rgb",
        "placement": "centre",
        "mean": [
          0,
          0,
          0
        ],
        "sigma": [
          1,
          1,
          1
        ]
      },
      "inference_cadence": {
        "numerator": 10,
        "denominator": 1
      },
      "source_constraints": {
        "min_width": 640,
        "min_height": 480,
        "max_width": 4096,
        "max_height": 2160,
        "min_fps_numerator": 10,
        "min_fps_denominator": 1
      },
      "resources": {
        "resident_bytes": 16777216,
        "max_tensor_bytes_per_source": 8388608,
        "output_queue_buffers": 2,
        "max_concurrent_sources": 16,
        "can_share_context_across_sources": true
      },
      "role": "primary"
    },
    {
      "model_id": "scrfd_500m_bnkps",
      "model_version": "1.0",
      "target_id": "qcs6490",
      "artifact_ref": "scrfd_500m_bnkps_w8a16.so",
      "artifact_sha256": "2f315dcd1996b0280c162e9bf79f0e1e64123675d4be2553ef698328dea103d9",
      "output_manifest_ref": "scrfd_500m_bnkps_outputs_v1",
      "decoder_contract": "face.detect.scrfd",
      "preprocess_contract": "nv12_rgb_letterbox_face_v1",
      "graph_name": "scrfd_500m_bnkps_w8a16",
      "preprocess": {
        "source_format": "nv12",
        "color_matrix": "bt709",
        "color_range": "limited",
        "resize": "letterbox",
        "interpolation": "bilinear",
        "placement": "top_left",
        "pad_value": [
          0.0,
          0.0,
          0.0
        ],
        "channel_order": "rgb",
        "normalization": {
          "formula": "offset_scale",
          "offset": [
            127.5,
            127.5,
            127.5
          ],
          "scale": [
            0.0078125,
            0.0078125,
            0.0078125
          ]
        },
        "coordinates": "tensor_pixels_xywh"
      },
      "input": {
        "width": 640,
        "height": 640,
        "dtype": "uint16",
        "channel_order": "rgb",
        "placement": "top_left",
        "mean": [
          0,
          0,
          0
        ],
        "sigma": [
          1,
          1,
          1
        ]
      },
      "inference_cadence": {
        "numerator": 10,
        "denominator": 1
      },
      "source_constraints": {
        "min_width": 640,
        "min_height": 480,
        "max_width": 4096,
        "max_height": 2160,
        "min_fps_numerator": 10,
        "min_fps_denominator": 1
      },
      "resources": {
        "resident_bytes": 16777216,
        "max_tensor_bytes_per_source": 8388608,
        "output_queue_buffers": 2,
        "max_concurrent_sources": 16,
        "can_share_context_across_sources": true
      },
      "role": "primary"
    },
    {
      "model_id": "edgeface_s_gamma_05",
      "model_version": "1.0",
      "target_id": "qcs6490",
      "artifact_ref": "edgeface_s_gamma_05_w8a16_ada_w8a16.so",
      "artifact_sha256": "6faf62d17323002ce028d984826abf8d52f06e222e8a6c4c52cea3be53e54815",
      "output_manifest_ref": "edgeface_s_gamma_05_outputs_v1",
      "decoder_contract": "face.embedding.edgeface",
      "preprocess_contract": "nv12_rgb_similarity_face_v1",
      "graph_name": "edgeface_s_gamma_05_w8a16_ada_w8a16",
      "preprocess": {
        "source_format": "nv12",
        "color_matrix": "bt709",
        "color_range": "limited",
        "resize": "crop",
        "interpolation": "bilinear",
        "placement": "stretch",
        "pad_value": [
          0.0,
          0.0,
          0.0
        ],
        "channel_order": "rgb",
        "normalization": {
          "formula": "offset_scale",
          "offset": [
            127.5,
            127.5,
            127.5
          ],
          "scale": [
            0.00784313725490196,
            0.00784313725490196,
            0.00784313725490196
          ]
        },
        "coordinates": "tensor_pixels_xywh"
      },
      "input": {
        "width": 112,
        "height": 112,
        "dtype": "uint16",
        "channel_order": "rgb",
        "placement": "stretch",
        "mean": [
          0,
          0,
          0
        ],
        "sigma": [
          1,
          1,
          1
        ]
      },
      "inference_cadence": {
        "numerator": 10,
        "denominator": 1
      },
      "source_constraints": {
        "min_width": 640,
        "min_height": 480,
        "max_width": 4096,
        "max_height": 2160,
        "min_fps_numerator": 10,
        "min_fps_denominator": 1
      },
      "resources": {
        "resident_bytes": 16777216,
        "max_tensor_bytes_per_source": 1048576,
        "output_queue_buffers": 2,
        "max_concurrent_sources": 16,
        "can_share_context_across_sources": false
      },
      "role": "secondary",
      "depends_on": [
        {
          "model_id": "scrfd_500m_bnkps",
          "model_version": "1.0",
          "target_id": "qcs6490"
        }
      ]
    },
    {
      "model_id": "yolo11n_fire_smoke",
      "model_version": "1.0",
      "target_id": "qcs6490",
      "artifact_ref": "libyolo11n_replaymix_w8a16.so",
      "artifact_sha256": "4b74ab5cfea57042dc9dbf26f19633552e08562c3e8a93c416e3e9cde2e0b513",
      "output_manifest_ref": "yolo11n_fire_smoke_outputs_v1",
      "decoder_contract": "yolo.v8.fire_smoke",
      "preprocess_contract": "nv12_rgb_letterbox_fire_smoke_v1",
      "graph_name": "yolo11n_replaymix_w8a16",
      "preprocess": {
        "source_format": "nv12",
        "color_matrix": "bt709",
        "color_range": "limited",
        "resize": "letterbox",
        "interpolation": "bilinear",
        "placement": "centre",
        "pad_value": [
          114.0,
          114.0,
          114.0
        ],
        "channel_order": "rgb",
        "normalization": {
          "formula": "offset_scale",
          "offset": [
            0.0,
            0.0,
            0.0
          ],
          "scale": [
            0.00392156862745098,
            0.00392156862745098,
            0.00392156862745098
          ]
        },
        "coordinates": "tensor_pixels_xywh"
      },
      "input": {
        "width": 320,
        "height": 320,
        "dtype": "uint16",
        "channel_order": "rgb",
        "placement": "centre",
        "mean": [
          0,
          0,
          0
        ],
        "sigma": [
          1,
          1,
          1
        ]
      },
      "inference_cadence": {
        "numerator": 10,
        "denominator": 1
      },
      "source_constraints": {
        "min_width": 320,
        "min_height": 320,
        "max_width": 4096,
        "max_height": 2160,
        "min_fps_numerator": 10,
        "min_fps_denominator": 1
      },
      "resources": {
        "resident_bytes": 16777216,
        "max_tensor_bytes_per_source": 4194304,
        "output_queue_buffers": 2,
        "max_concurrent_sources": 16,
        "can_share_context_across_sources": true
      },
      "role": "primary"
    }
  ]
}
